title,price,rating,reviews,availability
"JIKADA 61 Key Portable Electronic Keyboard Piano w/Lighted Full Size Keys,LCD,Headphones,X-Stand,Stool,Music Rest,Microphone,Note Stickers,Built-In Speakers,3 Teaching Modes,Ideal for Beginner Adult",,4.5 out of 5 stars,365 ratings,300+ bought in past month
"RockJam Compact 61 Key Keyboard with Sheet Music Stand, Power Supply, Piano Note Stickers & Simply Piano Lessons",,4.4 out of 5 stars,"31,655 ratings",1K+ bought in past month
"Korg, 88-Key Digital Pianos-Home (L1MRED)",$329.99,4.4 out of 5 stars,34 ratings,Not Available
"Yamaha YPT270 61-Key Portable Keyboard With Power Adapter (Amazon-Exclusive),Black",$159.99,4.8 out of 5 stars,"1,544 ratings",700+ bought in past month
Yamaha PSREW310 76-Key Touch Sensitive Portable Keyboard with PA130 Power Adapter,,4.7 out of 5 stars,786 ratings,200+ bought in past month
Yamaha PSRE373 61-Key Touch Sensitive Portable Keyboard with PA130 Power Adapter,$219.99,4.6 out of 5 stars,56 ratings,300+ bought in past month
"Donner Keyboard Piano 61 Key, Electric Keyboard Kit with 249 Voices, 249 Rhythms - Includes Piano Stand, Stool, Microphone, Gift for Beginners, Black (DEK-610S)",,4.5 out of 5 stars,215 ratings,100+ bought in past month
Roland GO:KEYS 61-key Music Creation Piano Keyboard with Integrated Bluetooth Speakers (GO-61K),$349.99,4.5 out of 5 stars,"1,146 ratings",100+ bought in past month
"MUSTAR Piano Keyboard, 61 Key Learning Keyboard Piano with Lighted Up Keys, Electric Piano Keyboard for Beginners, Piano Stand, Sustain Pedal, Headphones/Microphone, USB Midi, Built-in Speakers",$111.99 with 20 percent savings,4.4 out of 5 stars,538 ratings,400+ bought in past month
"JIKADA 61 Key Portable Electronic Keyboard Piano w/Lighted Full Size Keys,LCD,Headphones,X-Stand,Stool,Music Rest,Microphone,Note Stickers,Built-In Speakers,3 Teaching Modes,Ideal for Beginner Adult",$159.99,4.5 out of 5 stars,365 ratings,300+ bought in past month
"Starfavor 61 Key Electronic Keyboard Piano with LCD Display, Portable Electric Music Piano for Beginners Professions, include Z-style Stand, Bench, Microphone, Headphone, Keynote Stickers (SEK-561)",$169.99,4.2 out of 5 stars,551 ratings,200+ bought in past month
"Yamaha, 61-Key Portable Keyboard (PSRE473), Black",,4.6 out of 5 stars,204 ratings,100+ bought in past month
"Yamaha NP12 61-Key Lightweight Portable Keyboard with PA130 Power Adapter, Black",$239.99,4.6 out of 5 stars,"1,099 ratings",50+ bought in past month
Yamaha PSRSX900 Arranger Workstation keyboard,,4.6 out of 5 stars,364 ratings,Not Available
"Yamaha CK Series 88-Key Stage Keyboard with Built-In Speakers, Black (CK88)","$1,499.99",4.6 out of 5 stars,20 ratings,Not Available
"Yamaha PSR-E373 PKY 61-Key Premium Keyboard Pack with Power Supply, Bolt-On Stand, and Headphones, w YAM PSRE373",$249.95,4.4 out of 5 stars,135 ratings,Not Available
"Yamaha, 61-Key PSR-E273 Portable Keyboard with PA130 Power Adapter, Black",,4.7 out of 5 stars,24 ratings,Not Available
"Donner Keyboard Piano 61 Key, Electric Keyboard Kit with 249 Voices, 249 Rhythms - Includes Piano Stand, Stool, Microphone, Gift for Beginners, Black (DEK-610S)",,4.5 out of 5 stars,215 ratings,100+ bought in past month
"Fesley 88 Key Keyboard Piano with Semi-Weighted Keys, Full-Size Digital Piano Keyboard for Beginner, Piano Keyboard 88 Keys with Music Stand, Power Adapter, Sustain Pedal, Bluetooth, MIDI, Brown",,4.0 out of 5 stars,11 ratings,Not Available
"The ONE Smart Keyboard COLOR 61 Lighted Keys Piano Keyboard, MIDI Electric Piano for Beginners with 256 Tones, 64 Polyphony, Built-in LED Lights and Free Apps (Green)",$179.99 with 10 percent savings,4.5 out of 5 stars,156 ratings,100+ bought in past month
"Donner DEP-20 Beginner Digital Piano 88 Key Full Size Weighted Keyboard, Portable Electric Piano with Furniture Stand, 3-Pedal Unit",$498.99,4.6 out of 5 stars,"3,131 ratings",300+ bought in past month
"Donner DEP-20 Beginner Digital Piano 88 Key Full Size Weighted Keyboard, Portable Electric Piano with Furniture Stand, 3-Pedal Unit",,4.6 out of 5 stars,"3,131 ratings",300+ bought in past month
"Yamaha PSR-EW310 PKY 76-Key Premium Keyboard Pack with Power Supply, Bolt-On Stand, and Headphones, YAM PSREW310",$329.99,4.5 out of 5 stars,177 ratings,Not Available
Yamaha EZ300 61-Key Portable Keyboard with Lighted Keys and PA130 Power Adapter,$299.99,4.7 out of 5 stars,229 ratings,50+ bought in past month
"Yamaha 61-Key Piaggero Ultra-Portable Digital Piano, Black (NP15WH)",$269.99,2.5 out of 5 stars,2 ratings,Not Available
"Yamaha PSR-I500 61-Key Portable Keyboard With Indian Voices, Styles and Songs",$399.99,4.4 out of 5 stars,76 ratings,Not Available
Yamaha PSR-EW410 76-Key Portable Keyboard,$469.99,4.7 out of 5 stars,172 ratings,Not Available
YAMAHA PSR-E263 61-Key Portable Keyboard,,4.6 out of 5 stars,"1,399 ratings",Not Available
Yamaha PSR-A5000 61-Key World Music Arranger Workstation,"$1,999.99",4.1 out of 5 stars,17 ratings,Not Available
"Donner Keyboard Piano, 61 Key Piano Keyboard for Beginner/Professional, Electric Piano with Microphone & Piano App, Supports MP3/USB MIDI/Microphone/Insertion of the pedal (DEK610+Mic+Stand+Stool)",$169.99,4.4 out of 5 stars,"3,230 ratings",1K+ bought in past month
"Casio Portable Keyboard, Compact (SA-51)",$69.99,4.2 out of 5 stars,43 ratings,300+ bought in past month
"Casio CT-S200BK 61-Key Premium Keyboard Pack with Stand, Headphones & Power Supply, Black (CAS CTS200BK PPK)",$169.99,4.7 out of 5 stars,"3,603 ratings",100+ bought in past month
"RockJam Compact 61 Key Keyboard with Sheet Music Stand, Power Supply, Piano Note Stickers & Simply Piano Lessons",,4.4 out of 5 stars,"31,655 ratings",1K+ bought in past month
"Alesis Melody 61 Key Keyboard Piano for Beginners with Speakers, Stand, Bench, Headphones, Microphone, Sheet Music Stand, 300 Sounds and Music Lessons",$139.99,4.6 out of 5 stars,"27,138 ratings",1K+ bought in past month
"RockJam 61 Key Keyboard Piano With LCD Display Kit, Stand, Bench, Headphones, Simply App & Keynote Stickers",$148.50,4.5 out of 5 stars,"40,991 ratings",200+ bought in past month
"Casio Casiotone, 61-Key Portable Keyboard with USB (CT-S300)",,4.7 out of 5 stars,"1,984 ratings",100+ bought in past month
"MUSTAR Piano Keyboard with Lighted Up Keys, Learning Keyboard Piano 61 Keys for Beginners, Electric Piano Keyboard with Bench, Piano Stand, Headphones, Microphone, Note Stickers, Built-in Speakers",,4.6 out of 5 stars,8 ratings,200+ bought in past month
"Digital Piano, 88 Key Weighted Home Piano Bundle for Beginner Professional with Furniture Stand, Slide Key Cover, Black, by Vangoa",,4.4 out of 5 stars,44 ratings,Not Available
"MUSTAR 88 Key Weighted Keyboard Piano, Full Size Digital Piano 88 Weighted Keys with Stand, Electric Piano Keyboard 88 Keys Semi Weighted with 2x25W Speakers, USB/MIDI, Case, Sustain Pedal, Black",,5.0 out of 5 stars,1 rating,Not Available
"Starfavor 61 Key Electronic Keyboard Piano with LCD Display, Portable Electric Music Piano for Beginners Professions, include Z-style Stand, Bench, Microphone, Headphone, Keynote Stickers (SEK-561)",$169.99,4.2 out of 5 stars,551 ratings,200+ bought in past month
"Casio, 61-Key Portable Keyboard (CT-S1BK)",,4.8 out of 5 stars,803 ratings,100+ bought in past month
"Casio, 61-Key Portable Keyboard (CT-S1BK)",,4.8 out of 5 stars,803 ratings,100+ bought in past month
Pyle Digital Musical Karaoke Portable Electronic Piano Keyboard Includes Water-Resistant Case Bag & Keyboard Stool & Keyboard Stand (61 Keys) (PKBRD6151PB),$268.99 with 16 percent savings,4.4 out of 5 stars,46 ratings,Not Available
Roland JUNO-DS 61-Key Lightweight Synth-Action Keyboard with Pro Sounds,$799.99,4.6 out of 5 stars,371 ratings,Not Available
Roland GO:KEYS 61-key Music Creation Piano Keyboard with Integrated Bluetooth Speakers (GO-61K),$349.99,4.5 out of 5 stars,"1,146 ratings",100+ bought in past month
"MUSTAR Piano Keyboard with Lighted Up Keys, Learning Keyboard Piano 61 Keys for Beginners, Electric Piano Keyboard with Bench, Piano Stand, Headphones, Microphone, Note Stickers, Built-in Speakers",,4.6 out of 5 stars,8 ratings,200+ bought in past month
"Fesley Piano Keyboard 88 Keys, Full-Size Digital Piano Keyboard, Portable Electric Keyboard Piano, 88 Key Keyboard With Music Stand, Power Adapter, Sustain Pedal, Bluetooth, MIDI",$159.99,5.0 out of 5 stars,9 ratings,Not Available
"Casio, 61-Key Portable Keyboard (CT-S1BK)",,4.8 out of 5 stars,803 ratings,100+ bought in past month
"The ONE Smart Keyboard COLOR 61 Lighted Keys Piano Keyboard, MIDI Electric Piano for Beginners with 256 Tones, 64 Polyphony, Built-in LED Lights and Free Apps (Green)",$179.99 with 10 percent savings,4.5 out of 5 stars,156 ratings,100+ bought in past month
"MUSTAR Piano Keyboard, 61 Key Learning Keyboard Piano with Lighted Up Keys, Electric Piano Keyboard for Beginners, Piano Stand, Sustain Pedal, Headphones/Microphone, USB Midi, Built-in Speakers",$111.99 with 20 percent savings,4.4 out of 5 stars,538 ratings,400+ bought in past month
Roland GO:KEYS 61-key Music Creation Piano Keyboard with Integrated Bluetooth Speakers (GO-61K),$349.99,4.5 out of 5 stars,"1,146 ratings",100+ bought in past month
"Lexington 88 Keys Weighted Digital Piano, Full Size Portable Hammer Action Electric Keyboard Piano for Beginners w/Furniture Stand, Power Adapter, Triple Pedals, Headphone Jack and Recording, Black",,4.5 out of 5 stars,127 ratings,Not Available
"Starfavor 61 Key Electronic Keyboard Piano with LCD Display, Portable Electric Music Piano for Beginners Professions, include Z-style Stand, Bench, Microphone, Headphone, Keynote Stickers (SEK-561)",,4.2 out of 5 stars,551 ratings,200+ bought in past month
"Carry-On, 49-Key Portable Keyboard (FOLDPIANO49)",$59.99,4.2 out of 5 stars,447 ratings,300+ bought in past month
"Alesis Harmony 61 Pro - 61 Key Keyboard Piano with Adjustable Touch Response, USB Midi, 580 Sounds, X/Y Performance Touchpad with DJ-Style FX",,3.8 out of 5 stars,15 ratings,50+ bought in past month
"Vangoa VGK611 Piano Keyboard for Beginner, 61 Keys Electric Keyboard Piano Portable Music Keyboard with Mini Lighted Keys, Electronic Piano for Kids Boy Girl, White",,4.4 out of 5 stars,"1,600 ratings",50+ bought in past month
"JIKADA 61 Key Portable Electronic Keyboard Piano w/Lighted Full Size Keys,LCD,Headphones,X-Stand,Stool,Music Rest,Microphone,Note Stickers,Built-In Speakers,3 Teaching Modes,Ideal for Beginner Adult",,4.5 out of 5 stars,365 ratings,300+ bought in past month
Casio WK-7600 76-Key Workstation Keyboard with Power Supply medium,$449.00,4.6 out of 5 stars,621 ratings,Not Available
"Donner Folding Bluetooth Piano Keyboard, 61 Keys Sensitive Travel Piano Keyboard for Beginner, Portable Music Keyboard with Music Rest, Piano Bag, Piano Pedal, Piano APP, DP-06 White",$129.99,4.3 out of 5 stars,49 ratings,100+ bought in past month
"Best Choice Products 61-Key Beginners Complete Electronic Keyboard Piano Set w/Lighted Keys, LCD Screen, Headphones, Stand, Bench, Teaching Modes, Note Stickers, Built-In Speakers",$129.99,4.6 out of 5 stars,"5,515 ratings",300+ bought in past month
"MUSTAR Piano Keyboard, 61 Key Learning Keyboard Piano with Lighted Up Keys, Electric Piano Keyboard for Beginners, Piano Stand, Sustain Pedal, Headphones/Microphone, USB Midi, Built-in Speakers",,4.4 out of 5 stars,538 ratings,400+ bought in past month
Casio CT-X700 61-Key Portable Keyboard,$191.46,4.6 out of 5 stars,"3,616 ratings",200+ bought in past month
"Fesley 88 Key Keyboard Piano with Semi-Weighted Keys, Full-Size Digital Piano Keyboard for Beginner, Piano Keyboard 88 Keys with Music Stand, Power Adapter, Sustain Pedal, Bluetooth, MIDI, Brown",,4.0 out of 5 stars,11 ratings,Not Available
"The ONE Smart Keyboard COLOR 61 Lighted Keys Piano Keyboard, MIDI Electric Piano for Beginners with 256 Tones, 64 Polyphony, Built-in LED Lights and Free Apps (Green)",,4.5 out of 5 stars,156 ratings,100+ bought in past month
"Digital Piano, 88 Key Weighted Home Piano Bundle for Beginner Professional with Furniture Stand, Slide Key Cover, Black, by Vangoa",$589.99,4.4 out of 5 stars,44 ratings,Not Available
"MUSTAR 61 Key Piano Keyboard, Electric Piano Keyboard with Lighted Up Keys, Learning Keyboards Piano for Beginners, Piano Stand, LCD Screen, Headphones, Microphone, Kids Birthday Gifts",,4.5 out of 5 stars,498 ratings,100+ bought in past month
"Donner Keyboard Piano 61 Key, Electric Keyboard Kit with 249 Voices, 249 Rhythms - Includes Piano Stand, Stool, Microphone, Gift for Beginners, Black (DEK-610S)",,4.5 out of 5 stars,215 ratings,100+ bought in past month
"Hamzer 61-Key Portable Electronic Keyboard Piano with Stand, Stool, Headphones, Microphone & Sticker Sheet",$129.99,4.5 out of 5 stars,"4,744 ratings",400+ bought in past month
Yamaha Montage M8x 88-key Flagship Synthesizer with GEX action,"$4,499.99",Previous page,,Not Available
"Casio, 61-Key Portable Keyboard with USB (LK-S250)",$178.99,4.7 out of 5 stars,"1,059 ratings",50+ bought in past month
"Best Choice Products 61-Key Electronic Keyboard Piano Portable Electric Keyboard Complete Beginner Keyboard Set w/LED Screen, Power Adapter, Stand, Bench, Headphones, Microphone",$124.99,4.6 out of 5 stars,"3,094 ratings",100+ bought in past month
"ZENY 61-Key Portable Electric Keyboard Piano with Built In Speakers, LED Screen, Headphones, Microphone, Piano Stand, Music Sheet Stand and Stool",,4.5 out of 5 stars,"1,570 ratings",400+ bought in past month
KOCASO 61 Keys Piano Keyboard Digital Music Electronic Keyboard with Microphone Electric Piano Musical Instrument Learning Keyboard For Beginners Girls Boys,$21.99,4.5 out of 5 stars,4 ratings,Not Available
"Roland GO:Piano, 88-Key Digital Piano (GO-88P), 88Keys",,4.5 out of 5 stars,"1,146 ratings",50+ bought in past month
YAMAHA PSR-E263 61-Key Portable Keyboard,$189.99,4.6 out of 5 stars,"1,399 ratings",Not Available
"Starfavor Semi-weighted Piano Keyboard 88 Keys with Stand, Sustain Pedal, and Carrying Case, SEK-88A",$179.99,4.0 out of 5 stars,638 ratings,500+ bought in past month
"Pyle Digital Piano Kids Keyboard - Portable 61 Key Piano Keyboard, Learning Keyboard for Beginners w/ Drum Pad, Recording, Microphone, Music Sheet Stand, Built-in Speaker - Pyle PKBRD6111 , Black",,4.4 out of 5 stars,"1,777 ratings",100+ bought in past month
"MUSTAR 88 Key Weighted Keyboard Piano, Full Size Digital Piano 88 Weighted Keys with Stand, Electric Piano Keyboard 88 Keys Semi Weighted with 2x25W Speakers, USB/MIDI, Case, Sustain Pedal, Black",$259.99,5.0 out of 5 stars,1 rating,Not Available
"MUSTAR Digital Piano 88 Weighted Keys with Stand Touch Sensitivity, Piano Keyboard 88 Keys Semi Weighted Electric Piano with Bluetooth Connection, Portable Case, Sustain Pedal, MDF, White",$267.99,4.3 out of 5 stars,110 ratings,Not Available
"Casio Privia PX-870 Digital Piano - Black Bundle with Furniture Bench, Instructional Book, Online Lessons, Austin Bazaar Instructional DVD, and Polishing Cloth",$999.00 with 9 percent savings,4.5 out of 5 stars,350 ratings,Not Available
"PopuPiano Smart Piano Keyboard with Rainbow Lighting, Interactive App Lessons for Beginners, 256 Tones, 100+ Chords Polyphony, MIDI Controller, AIGC Composition, Portable Expandable Keyboard Piano",,4.3 out of 5 stars,23 ratings,Not Available
"PopuPiano Smart Piano Keyboard with Rainbow Lighting, Interactive App Lessons for Beginners, 256 Tones, 100+ Chords Polyphony, MIDI Controller, AIGC Composition, Portable Expandable Keyboard Piano",$299.99,4.3 out of 5 stars,23 ratings,Not Available
"Starfavor Piano Keyboard 88 Keys, Full-size 88 Key Keyboard Piano Semi Weighted Keyboard, Bluetooth MIDI Chargeable Portable Piano with Piano Stand, Sustain Pedal, Carrying Bag, SP-88S(Black)",$159.99 with 36 percent savings,4.1 out of 5 stars,40 ratings,50+ bought in past month
"Fesley Piano Keyboard 88 Keys, Full-Size Digital Piano Keyboard, Portable Electric Keyboard Piano, 88 Key Keyboard With Music Stand, Power Adapter, Sustain Pedal, Bluetooth, MIDI",$159.99,5.0 out of 5 stars,9 ratings,Not Available
"The ONE Premium Upright Digital Piano with Lighted Keys, 88 Hammer Action Keys Piano Keyboard for Beginner Professional, Wooden Classic Weighted Keyboard with Piano Stand/3-Pedal Unit/Free APP",$999.99 with 9 percent savings,4.5 out of 5 stars,224 ratings,Not Available
"Best Choice Products 61-Key Electronic Keyboard Piano Portable Electric Keyboard Complete Beginner Keyboard Set w/LED Screen, Power Adapter, Stand, Bench, Headphones, Microphone",$124.99,4.6 out of 5 stars,"3,094 ratings",100+ bought in past month
"Folding Piano Keyboard, 88 Keys Full Size Semi-Weighted Foldable Piano, Support MIDI USB Interface Bluetooth Portable Piano with LCD Screen Sheet Music Stand Sticker Sustain Pedal for Beginners Kids",$179.99,4.5 out of 5 stars,66 ratings,50+ bought in past month
"Hamzer 61-Key Electronic Piano Electric Organ Music Keyboard with Stand, Microphone, & Sticker Sheet - Black",,4.5 out of 5 stars,"2,720 ratings",50+ bought in past month
"The ONE Smart Keyboard COLOR 61 Lighted Keys Piano Keyboard, MIDI Electric Piano for Beginners with 256 Tones, 64 Polyphony, Built-in LED Lights and Free Apps (Green)",$179.99 with 10 percent savings,4.5 out of 5 stars,156 ratings,100+ bought in past month
Roland GO:KEYS 61-key Music Creation Piano Keyboard with Integrated Bluetooth Speakers (GO-61K),$349.99,4.5 out of 5 stars,"1,146 ratings",100+ bought in past month
"Lexington 88 Key Beginner Digital Piano Weighted for Adults Kids, Portable Wooden Electric Piano Keyboard Full Size with Graded Hammer Action, Sustain Pedal and Power Supply, Black",$283.79,4.5 out of 5 stars,127 ratings,Not Available
Hamzer 61-Key Digital Music Piano Keyboard - Portable Electronic Musical Instrument - with Microphone and Sticker Sheet,,4.4 out of 5 stars,"1,911 ratings",100+ bought in past month
"Kmise Piano Keyboard 88 Key Full Size Semi Weighted Electronic Digital Piano with Music Stand,Power Supply,Sustain Pedal,Bluetooth,MIDI,for Beginner Professional at Home/Stage",,4.2 out of 5 stars,"1,529 ratings",50+ bought in past month
"Roland GO:Piano, 88-Key Digital Piano (GO-88P), 88Keys",$393.91,4.5 out of 5 stars,"1,146 ratings",50+ bought in past month
"Starfavor Semi-weighted Piano Keyboard 88 Keys with Stand, Sustain Pedal, and Carrying Case, SEK-88A",$179.99,4.0 out of 5 stars,638 ratings,500+ bought in past month
"Pyle Digital Piano Kids Keyboard - Portable 61 Key Piano Keyboard, Learning Keyboard for Beginners w/ Drum Pad, Recording, Microphone, Music Sheet Stand, Built-in Speaker - Pyle PKBRD6111 , Black",,4.4 out of 5 stars,"1,777 ratings",100+ bought in past month
"PopuPiano Smart Piano Keyboard - Rainbow Lights Keys, Interactive App Lessons for Beginners, 256+Tones, 100+ Chords Polyphony, MIDI Controller, AIGC Composition, Portable Expandable Keyboard Piano",$244.99 with 30 percent savings,4.3 out of 5 stars,23 ratings,50+ bought in past month
"Yamaha, 37-Key Melodica, (P-37ERD)",,4.7 out of 5 stars,17 ratings,Not Available
"M SANMERSEN Piano Keyboard for Beginners, 37 Keys Built-in 1200mA Rechargeable Battery Electronic Piano Keyboard Portable Music Piano Keyboard with Mic LED Screen Teaching Gift for Beginners, Black",$49.99,4.3 out of 5 stars,241 ratings,200+ bought in past month
Yamaa EZ300 Kit 61-Key Touch Sensitive Touch Sensitive Portable Keyboard with SK B2,$355.00,5.0 out of 5 stars,4 ratings,Not Available
KOCASO 61 Keys Piano Keyboard Digital Music Electronic Keyboard with Microphone Electric Piano Musical Instrument Learning Keyboard For Beginners Girls Boys,$21.99,4.5 out of 5 stars,4 ratings,Not Available
"Costzon 61 Key Keyboard Piano with LCD Screen, Portable Digital Piano w/Microphone Headphone, Adjustable Stand, Foldable Piano Bench, Dual Power Supply, Perfect for Beginners Adults (Black)",$119.99,4.5 out of 5 stars,227 ratings,Not Available
"Fesley 88 Key Keyboard Piano with Semi-Weighted Keys, Full-Size Digital Piano Keyboard for Beginner, Piano Keyboard 88 Keys with Music Stand, Power Adapter, Sustain Pedal, Bluetooth, MIDI, Brown",$179.99,4.0 out of 5 stars,11 ratings,Not Available
"Asmuse 88 Key Digital Piano, Full-Size Semi-Weighted Keys Electric Keyboard Piano, Portable Piano Keyboard with MIDI/USB for Beginner Adults Practice (Brown)",$269.99,4.8 out of 5 stars,11 ratings,Not Available
"Casio Privia PX-870 Digital Piano - Black Bundle with Furniture Bench, Instructional Book, Online Lessons, Austin Bazaar Instructional DVD, and Polishing Cloth",$999.00 with 9 percent savings,4.5 out of 5 stars,350 ratings,Not Available
Hamzer 61-Key Digital Music Piano Keyboard - Portable Electronic Musical Instrument - with Microphone and Sticker Sheet,$74.99,4.4 out of 5 stars,"1,911 ratings",100+ bought in past month
"Ashthorpe 61-Key Digital Electronic Keyboard Piano with Light Up Keys, Portable Beginner Kit Includes Headphones, Mic and Keynote Stickers",,4.5 out of 5 stars,65 ratings,Not Available
"The ONE Smart Keyboard COLOR 61 Lighted Keys Piano Keyboard, Digital Piano for Beginners with 256 Tones, 64 Polyphony, Built-in LED Lights and Free Apps (Pink)",$179.99 with 10 percent savings,4.5 out of 5 stars,156 ratings,100+ bought in past month
"88 Key Weighted Keyboard Piano,Kmise Full Size Heavy Hammer Action Key Digital Piano with Music Stand Pedal MIDI Connecting for Professional Beginner",$259.99,4.2 out of 5 stars,"1,529 ratings",Not Available
"Ashthorpe 61-Key Digital Electronic Keyboard Piano with Light Up Keys, Includes Stand, Bench, Headphones, Mic and Keynote Stickers",$112.99,4.4 out of 5 stars,208 ratings,50+ bought in past month
"Dascooni Piano Keyboard - 61 Key Keyboard Piano, Electric Piano Music Keyboard with Built-in Dual Speakers and Microphone, Music Stand and Power Supply, Portable Keyboard Piano for Beginners",$48.99,4.5 out of 5 stars,201 ratings,50+ bought in past month
TERENCE Keyboard Piano with 61 Semi-weighted Keys LCD Display & 1800mAh Battery Support MIDI USB Interface & Piano Application with Bluetooth Sheet Music Stand Sticker Bag Audio Cable Earphones,$159.99,4.2 out of 5 stars,69 ratings,Not Available
"61-Key Electronic Music Keyboard Piano with Stand, Headphones, Stool & Microphone",$89.99,4.4 out of 5 stars,98 ratings,200+ bought in past month
"Donner Folding Bluetooth Piano Keyboard, 61 Keys Sensitive Travel Piano Keyboard for Beginner, Portable Music Keyboard with Music Rest, Piano Bag, Piano Pedal, Piano APP, DP-06 White",$129.99,4.3 out of 5 stars,49 ratings,100+ bought in past month
"61 keys keyboard piano, Electronic Digital Piano with Built-In Speaker Microphone, Sheet Stand and Power Supply, Portable piano Keyboard Gift Teaching for Beginners",,3.4 out of 5 stars,8 ratings,100+ bought in past month
"Amazon Basics Portable Digital Piano Keyboard with 61 Keys, Built In Speakers and Songs for Learning, Black",$131.99,4.2 out of 5 stars,21 ratings,100+ bought in past month
"[2023 Upgraded] Full Size Digital Piano Keyboard, 88 Key Folding Piano with Bluetooth MIDI, Semi-Weighted Portable Piano Keyboards, Wood Grained Electric Piano for Beginners, Kids, Adults By COSSAIN",$219.99,4.1 out of 5 stars,37 ratings,Not Available
"Donner DDP-100S Digital Piano 88 Key Weighted Graded Hammer-Action Piano Keyboard with MIDI IN/OUT, 200 Sounds, 200 Rhythms, 100 Demo, Home Electric Piano Bundle with Bench for Beginner Professional",,4.6 out of 5 stars,"1,313 ratings",50+ bought in past month
"Fesley 88 Key Weighted Digital Piano Keyboard, Full-Size Electric Keyboard Piano, Electric Piano Keyboard 88 Keys, 88 Key Keyboard with Triple Pedal, Headphone, 2x20W Speakers, Recording",$329.99,5.0 out of 5 stars,6 ratings,Not Available
Roland JUNO-DS 61-Key Lightweight Synth-Action Keyboard with Pro Sounds,$799.99,4.6 out of 5 stars,371 ratings,Not Available
"PopuPiano Smart Piano Keyboard with Rainbow Lighting, Interactive App Lessons for Beginners, 256 Tones, 100+ Chords Polyphony, MIDI Controller, AIGC Composition, Portable Expandable Keyboard Piano",$299.99,4.3 out of 5 stars,23 ratings,Not Available
"PopuPiano Smart Piano Keyboard with Rainbow Lighting, Interactive App Lessons for Beginners, 256 Tones, 100+ Chords Polyphony, MIDI Controller, AIGC Composition, Portable Expandable Keyboard Piano",$299.99,4.3 out of 5 stars,23 ratings,Not Available
"Fesley 88 Key Keyboard Piano with Semi-Weighted Keys, Full-Size Digital Piano Keyboard for Beginner, Piano Keyboard 88 Keys with Music Stand, Power Adapter, Sustain Pedal, Bluetooth, MIDI, Brown",$179.99,4.0 out of 5 stars,11 ratings,Not Available
ROLAND FP-60X Digital Pianos-Home (FP-60X-WH),$999.99 with 20 percent savings,4.3 out of 5 stars,13 ratings,Not Available
"The ONE Smart Keyboard COLOR 61 Lighted Keys Piano Keyboard, MIDI Electric Piano for Beginners with 256 Tones, 64 Polyphony, Built-in LED Lights and Free Apps (Green)",$179.99 with 10 percent savings,4.5 out of 5 stars,156 ratings,100+ bought in past month
"[2023 Upgraded] Full Size Digital Piano Keyboard, 88 Key Folding Piano with Bluetooth MIDI, Semi-Weighted Portable Piano Keyboards, Wood Grained Electric Piano for Beginners, Kids, Adults By COSSAIN",,4.1 out of 5 stars,37 ratings,Not Available
"MAMIZO 61 Key Keyboard Piano, Electric Piano Keyboard for Beginners with X-Stand, Stool, Microphone, Dual Power Supply, 3 Teaching Modes, LCD, Supports USB MIDI, Christmas Gifts for Children",$79.99,4.8 out of 5 stars,11 ratings,Not Available
"Starfavor 61 Key Electronic Keyboard Piano with LCD Display, Portable Electric Music Piano for Beginners Professions, include Z-style Stand, Bench, Microphone, Headphone, Keynote Stickers (SEK-561)",$169.99,4.2 out of 5 stars,551 ratings,200+ bought in past month
