title,price,rating,reviews,availability
"The ONE Smart Keyboard COLOR 61 Lighted Keys Piano Keyboard, MIDI Electric Piano for Beginners with 256 Tones, 64 Polyphony, Built-in LED Lights and Free Apps (Green)",$179.99 with 10 percent savings,4.5 out of 5 stars,156 ratings,100+ bought in past month
Roland GO:KEYS 61-key Music Creation Piano Keyboard with Integrated Bluetooth Speakers (GO-61K),$349.99,4.5 out of 5 stars,"1,146 ratings",100+ bought in past month
Hamzer 61-Key Digital Music Piano Keyboard - Portable Electronic Musical Instrument - with Microphone and Sticker Sheet,$74.99,4.4 out of 5 stars,"1,911 ratings",100+ bought in past month
"Lexington 88 Keys Weighted Digital Piano, Full Size Portable Hammer Action Electric Keyboard Piano for Beginners w/Furniture Stand, Power Adapter, Triple Pedals, Headphone Jack and Recording, Black",$377.59,4.5 out of 5 stars,127 ratings,Not Available
"Hamzer 61-Key Electronic Keyboard Portable Digital Music Piano with Lighted Keys, Microphone & Sticker Set",$81.99,4.5 out of 5 stars,385 ratings,Not Available
"61 Key Digital Music Piano Keyboard for Kids,Portable Electronic Musical Instrument,Multi-function Keyboard with Microphone Gifts for Boys and Girls",$32.96,3.8 out of 5 stars,246 ratings,100+ bought in past month
"Keyboard Piano 61 Key Electric Piano Keyboard for Beginners/Professional, Portable Light Up Music Keyboard Built-in Dual Speakers with LED Display, Music Stand, Stand, Microphone, Bench (A)",$106.99,4.3 out of 5 stars,33 ratings,100+ bought in past month
"[2023 New]FingerBallet 88 Key Folding Piano Keyboard,Full Size Semi-Weighted Portable Digital Piano,Foldable keyboard Built-in Bluetooth & MIDI for Adult, Toddlers, Kids",$209.99,4.7 out of 5 stars,19 ratings,Not Available
"GLARRY 61-Key Portable Electronic Keyboard Piano set w/LCD Screen, Stand, Microphone, Headphones, Stand, Bench, Teaching Modes, Built-In Speakers",,4.6 out of 5 stars,149 ratings,Not Available
"Soulmate Foldable Piano 61 Key Keyboard Piano Semi Weighted Keys Portable Electronic Piano, Bluetooth & MIDI, Bag Foldable Keyboard Piano for Beginner, Black",$109.99,4.5 out of 5 stars,36 ratings,Not Available
Yamaha SKB2 Survival Kit for Portable Yamaha Keyboards,$34.99 with 29 percent savings,4.1 out of 5 stars,88 ratings,Not Available
Lexington EK3282 32-Key Mini Electric Digital Portable Keyboard Piano Musical Gift for Kids,,4.5 out of 5 stars,127 ratings,200+ bought in past month
"FingerBallet Portable Piano Keyboard, Semi-Weighted Folding Digital Piano 88 Key, Full Size, Wood Grain, Electric Piano Keyboard w/MIDI Bluetooth, Suitable for Adult, Toddler, Kids",$178.95,4.7 out of 5 stars,39 ratings,50+ bought in past month
"Hamzer 61-Key Electronic Keyboard Portable Digital Music Piano with Lighted Keys, H-Stand, Stool, Headphones, Microphone, & Sticker Set",$127.99,4.6 out of 5 stars,438 ratings,50+ bought in past month
"ZHRUNS Digital Piano 88 Key Wooden Heavy Hammer Piano Keyboard, Full-size Weighted Keyboard Electric Piano for Beginners, Sheet Music Stand, Triple Pedal, Power Adapter, Supports USB-MIDI Connecting",$399.98,4.5 out of 5 stars,24 ratings,Not Available
Roland JUNO-DS 61-Key Lightweight Synth-Action Keyboard with Pro Sounds,,4.6 out of 5 stars,371 ratings,Not Available
"Lexington 88 Keys Weighted Digital Piano, Full Size Portable Hammer Action Electric Keyboard Piano for Beginners w/Furniture Stand, Power Adapter, Triple Pedals, Headphone Jack and Recording, Black",$377.59,4.5 out of 5 stars,127 ratings,Not Available
"JOYROX 61 Key Piano Keyboard, keyboard Piano for Beginner, Electric Piano with Piano Stand, Bench, Music Stand & Headphones, Supports Recording/Microphone, Music Keyboard for Indoor/Outdoor",$99.99 with 10 percent savings,4.0 out of 5 stars,18 ratings,Not Available
"KONIX Piano Keyboard 88 Key, Beginner Semi Weighted Keyboard Piano with Full Size Key, Portable Electric Piano Keyboard Include Sustain Pedal, Power Supply and Piano Bag",$189.99,4.4 out of 5 stars,20 ratings,Not Available
"Hricane Keyboard Piano Lighted Keys for Beginner Adults Teens Kids, 61 Key Electronic Music Keyboard with Teaching Modes Powered by USB or Battery with LCD Display Microphone Headphone Jack",$75.99,4.3 out of 5 stars,833 ratings,50+ bought in past month
"Piano Keyboard for Kids, EOOLEOW 37 Keys Portable Electronic Piano for kids with Microphone - Music Keyboard Piano Toys for 3 4 5 6 7 8 9 Year Old Boys and Girls (Black)",,3.9 out of 5 stars,101 ratings,100+ bought in past month
"Keyboard Piano 61 Key, STRICH Electric Piano Keyboard Set for Beginners, Full Size Electronic Keyboard with Stand, Stool, Microphone & Sheet Music Stand, SEK-600 Bundle",$159.99,4.5 out of 5 stars,21 ratings,Not Available
"61 keys keyboard piano, Electronic Digital Piano with Built-In Speaker Microphone, Portable Keyboard Gift Teaching for Beginners, electric piano for kids",$39.96 with 9 percent savings,3.4 out of 5 stars,29 ratings,200+ bought in past month
"Starument 61 Key Premium Electric Keyboard Piano for Beginners with Stand, Built-in Dual Speakers, Microphone, Headphone, Bench & Display Panel",$149.99 with 17 percent savings,4.3 out of 5 stars,279 ratings,200+ bought in past month
"RockJam 61 Key Keyboard Piano with Pitch Bend, Power Supply, Sheet Music Stand, Piano Note Stickers & Simply Piano Lessons",,4.4 out of 5 stars,"4,641 ratings",Not Available
"Asmuse 88-Key Full Size Electric Piano Keyboard Set, Digital Piano with Sustain Pedal, Power Supply, Built-In Speakers, Black",,4.2 out of 5 stars,"1,221 ratings",100+ bought in past month
"Pyle, Digital Musical Karaoke Portable Electronic Piano Includes Water-Resistant Case Bag, Keyboard Stand, Sustain Pedal & Headset (61 Keys) (PKBRD6175P)",,4.4 out of 5 stars,46 ratings,Not Available
"Costzon 61-Key Electronic Keyboard Piano w/Lighted Keys, Built-in Speakers, Recorder, 255 Timbres/Rhythms, 3 Teaching Modes, LCD Display, Headphones, Adjustable Stand for Beginner Adults (Black)",,4.6 out of 5 stars,240 ratings,Not Available
"Eastar Electric Piano, 61 Keys Piano Keyboard for Beginners, Digital Piano with Luxury Package, Includes Stand, Bench, Music Stand, Headset, Microphone and Musical Note Stickers, Pink",$179.99,4.5 out of 5 stars,319 ratings,100+ bought in past month
OneOdio Wired Over Ear Headphones Studio Monitor & Mixing DJ Stereo Headsets with 50mm Neodymium Drivers and 1/4 to 3.5mm Jack for AMP Computer Recording Podcast Keyboard Guitar Laptop - Black,$31.99 with 16 percent savings,4.4 out of 5 stars,"68,316 ratings",Not Available
"MUSTAR 88 Key Weighted Keyboard Piano, Full Size Digital Piano 88 Weighted Keys with Stand, Electric Piano Keyboard 88 Keys Semi Weighted with 2x25W Speakers, USB/MIDI, Case, Sustain Pedal, Black",,5.0 out of 5 stars,1 rating,Not Available
Roland GO:KEYS 61-key Music Creation Piano Keyboard with Integrated Bluetooth Speakers (GO-61K),$349.99,4.5 out of 5 stars,"1,146 ratings",100+ bought in past month
"MUSTAR Piano Keyboard, 61 Key Learning Keyboard Piano with Lighted Up Keys, Electric Piano Keyboard for Beginners, Piano Stand, Sustain Pedal, Headphones/Microphone, USB Midi, Built-in Speakers",$111.99 with 20 percent savings,4.4 out of 5 stars,538 ratings,400+ bought in past month
"MUSTAR Piano Keyboard, 61 Key Learning Keyboard Piano with Lighted Up Keys, Electric Piano Keyboard for Beginners, Piano Stand, Sustain Pedal, Headphones/Microphone, USB Midi, Built-in Speakers",,4.4 out of 5 stars,538 ratings,400+ bought in past month
Pyle Digital Musical Karaoke Portable Electronic Piano Keyboard Includes Water-Resistant Case Bag & Keyboard Stool & Keyboard Stand (61 Keys) (PKBRD6151PB),,4.4 out of 5 stars,46 ratings,Not Available
Roland JUNO-DS 61-Key Lightweight Synth-Action Keyboard with Pro Sounds,,4.6 out of 5 stars,371 ratings,Not Available
"Roland GO:Piano, 88-Key Digital Piano (GO-88P), 88Keys",$393.91,4.5 out of 5 stars,"1,146 ratings",50+ bought in past month
"Starfavor 61 Key Electronic Keyboard Piano with LCD Display, Portable Electric Music Piano for Beginners Professions, include Z-style Stand, Bench, Microphone, Headphone, Keynote Stickers (SEK-561)",$169.99,4.2 out of 5 stars,551 ratings,200+ bought in past month
TWFRIC Beginners Piano Keyboard 37 Keys Portable Electronic Keyboard Piano Built-in Rechargeable Battery Kids Piano with Headphone Jack Learning Musical Instruments Gifts for 3 4 5 6 7 Boys Girls,$49.89,4.2 out of 5 stars,227 ratings,50+ bought in past month
"Casio, 61-Key Portable Keyboard (CT-S400)",$247.16,4.6 out of 5 stars,70 ratings,Not Available
"The ONE Smart Keyboard COLOR 61 Lighted Keys Piano Keyboard, MIDI Electric Piano for Beginners with 256 Tones, 64 Polyphony, Built-in LED Lights and Free Apps (Green)",$179.99 with 10 percent savings,4.5 out of 5 stars,156 ratings,100+ bought in past month
"Hamzer 61-Key Portable Electronic Keyboard Piano with Stand, Stool, Headphones, Microphone & Sticker Sheet",,4.5 out of 5 stars,"4,744 ratings",400+ bought in past month
Roland GO:KEYS 61-key Music Creation Piano Keyboard with Integrated Bluetooth Speakers (GO-61K),,4.5 out of 5 stars,"1,146 ratings",100+ bought in past month
"Hamzer 61-Key Electronic Piano Electric Organ Music Keyboard with Stand, Microphone, & Sticker Sheet - Black",,4.5 out of 5 stars,"2,720 ratings",50+ bought in past month
Hamzer 61-Key Digital Music Piano Keyboard - Portable Electronic Musical Instrument - with Microphone and Sticker Sheet,,4.4 out of 5 stars,"1,911 ratings",100+ bought in past month
"61 keys keyboard piano, Electronic Digital Piano with Built-In Speaker Microphone, Sheet Stand and Power Supply, Portable piano Keyboard Gift Teaching for Beginners",,3.4 out of 5 stars,8 ratings,100+ bought in past month
"Yamaha PSRE360 61-Key Touch Sensitive Portable Keyboard with Power Supply, Dark Walnut",,4.6 out of 5 stars,209 ratings,Not Available
"24HOCL 61 Key Premium Electric Keyboard Piano for Beginners with Stand, Built-in Dual Speakers, Microphone, Headphone, Stand & Display Panel (Black)",$129.99,4.1 out of 5 stars,73 ratings,Not Available
"Soulmate Foldable Piano 61 Key Keyboard Piano Semi Weighted Keys Portable Electronic Piano, Bluetooth & MIDI, Bag Foldable Keyboard Piano for Beginner, Black",$109.99,4.5 out of 5 stars,36 ratings,Not Available
AQNIEGEP Piano Keyboard with Stand 61 Key Electric Keyboard Piano Music Keyboard for Beginner with Stand Bench Lighted Keyboard LED Screen Sheet Music Stand Dual-Speakers Microphone Note stickers,,4.1 out of 5 stars,14 ratings,Not Available
"Costzon 61-Key Electronic Keyboard Piano w/Lighted Keys, Built-in Speakers, Recorder, 255 Timbres/Rhythms, 3 Teaching Modes, LCD Display, Headphones, Adjustable Stand for Beginner Adults (Black)",,4.6 out of 5 stars,240 ratings,Not Available
"POGOLAB 49 Key Roll Up Keyboard Piano, Portable Digital Electric Foldable Piano Keyboard, Rechargeable, 8 Tones, 6 Educational Demo Songs, for Beginners Adults Gift (Rainbow)",,4.4 out of 5 stars,56 ratings,50+ bought in past month
"Yamaha, 37-Key Melodica, (P-37ERD)",$132.99,4.7 out of 5 stars,17 ratings,Not Available
"FingerBallet Portable Piano Keyboard, Semi-Weighted Folding Digital Piano 88 Key, Full Size, Wood Grain, Electric Piano Keyboard w/MIDI Bluetooth, Suitable for Adult, Toddler, Kids",,4.7 out of 5 stars,39 ratings,50+ bought in past month
"Fesley 88 Key Keyboard Piano with Semi-Weighted Keys, Full-Size Digital Piano Keyboard for Beginner, Piano Keyboard 88 Keys with Music Stand, Power Adapter, Sustain Pedal, Bluetooth, MIDI, Brown",$179.99,4.0 out of 5 stars,11 ratings,Not Available
"The ONE Smart Keyboard COLOR 61 Lighted Keys Piano Keyboard, MIDI Electric Piano for Beginners with 256 Tones, 64 Polyphony, Built-in LED Lights and Free Apps (Green)",$179.99 with 10 percent savings,4.5 out of 5 stars,156 ratings,100+ bought in past month
"Digital Piano, 88 Key Weighted Home Piano Bundle for Beginner Professional with Furniture Stand, Slide Key Cover, Black, by Vangoa",$589.99,4.4 out of 5 stars,44 ratings,Not Available
"TERENCE Piano Keyboard 88 Keys, Semi-Weighted Folding Piano Keyboard with MIDI Support Bluetooth Portable Piano with LCD Screen, 2X5W Speakers, Music Stand, Stickers, Earphones and 1/4'' Sustain Pedal",,4.5 out of 5 stars,22 ratings,Not Available
NikoMaku Digital Piano 88 Keys Foldable Portable Piano Keyboard Electric Keyboard Piano Folding MIDI Semi-weighted Touch Sensitive Keys Full Size Keys Touch Response 128 Rhythms 128 Tones Swan X Black,$169.00,4.1 out of 5 stars,52 ratings,Not Available
"Saturnpower 61-Key Portable Electronic Keyboard Piano with Built In Speakers, Headphones, Microphone, Dual Power Supply, Piano Stand, Music Sheet Stand and Stool for Beginner (Kid & Adult) Black",$75.99,4.5 out of 5 stars,203 ratings,50+ bought in past month
"GreenPro 61 Key Portable Electronic Piano Keyboard, LED Display with Adjustable Stand and Music Note Holder, 3 Teaching Modes, Electronic Musical Instruments Starter Set for Kids and Adults",,4.2 out of 5 stars,459 ratings,Not Available
"[2023 New]FingerBallet 88 Key Folding Piano Keyboard,Full Size Semi-Weighted Portable Digital Piano,Foldable keyboard Built-in Bluetooth & MIDI for Adult, Toddlers, Kids",,4.7 out of 5 stars,19 ratings,Not Available
"61-Key Electronic Keyboard Pack with Headphones,Microphone,Stand,Stool,and Power Supply-The electronic keyboards (Pack of 1)",$106.65,4.6 out of 5 stars,781 ratings,400+ bought in past month
"Ktaxon 61 Key Keyboard Piano with Light Up Keys, Electric Piano Set with Headphone, Microphone, Music Rest, Power Adapter, Piano Stand, Piano Bench and Manual",,4.3 out of 5 stars,31 ratings,Not Available
"Keyboard Piano 61 Key, STRICH Electric Piano Keyboard Set for Beginners, Full Size Electronic Keyboard with Stand, Stool, Microphone & Sheet Music Stand, SEK-600 Bundle",$159.99,4.5 out of 5 stars,21 ratings,Not Available
Yamaha EZ-250i Portatone Lighted Musical Keyboard,,4.0 out of 5 stars,5 ratings,Not Available
TERENCE Keyboard Piano with 61 Semi-weighted Keys & 1800mAh Battery Support MIDI USB Interface & Piano Application with Bluetooth Sheet Music Stand Sticker Bag Audio Cable Earphones,$155.99,4.3 out of 5 stars,116 ratings,Not Available
Semart piano keyboard for kids 61 key electric digital music keyboard for beginner portable piano w/LCD display microphone USB cable,$39.89 with 20 percent savings,3.8 out of 5 stars,549 ratings,50+ bought in past month
"FVEREY 88 Key Folding Piano Keyboard, Full Size Semi Weighted Keyboard, Travel Piano Portable Musical Keyboard, Support MIDI Bluetooth Electric Piano for Beginners Adults, White",$176.99,4.3 out of 5 stars,240 ratings,Not Available
"MUSTAR Digital Piano 88 Weighted Keys Hammer Action, Electric Piano Keyboard 88 Key Weighted Keyboard with Stand, Full Size 88 Key Keyboard Piano with Bluetooth Connection, Case, Sustain Pedal, White",$337.99,4.6 out of 5 stars,43 ratings,Not Available
"MUSTAR 88 Key Weighted Keyboard Piano, Full Size Digital Piano 88 Weighted Keys with Stand, Electric Piano Keyboard 88 Keys Semi Weighted with 2x25W Speakers, USB/MIDI, Case, Sustain Pedal, Black",$259.99,5.0 out of 5 stars,1 rating,Not Available
"MUSTAR Digital Piano 88 Weighted Keys with Stand Touch Sensitivity, 88 Key Semi Weighted Keyboard Piano Portable Electric Piano for Beginners, 2x25W Stereo Speakers, Case, Sustain Pedal, ABS, Black",,4.3 out of 5 stars,110 ratings,100+ bought in past month
"Casio, 61-Key Portable Keyboard (CT-S1BK)",$219.00,4.8 out of 5 stars,803 ratings,100+ bought in past month
"Casio, 61-Key Portable Keyboard (CT-S1BK)",$219.00,4.8 out of 5 stars,803 ratings,100+ bought in past month
